{
  "job_id": "beuc-food-policy-trainee-6-months-traineeship",
  "status": "archived",
  "saved_date": "2026-07-21",
  "applied_date": null,
  "withdrawn_date": null,
  "decision_date": "2026-07-21",
  "next_action": {
    "description": "Deadline passed (26 Jun 2026); keep for reference / watch future BEUC traineeships",
    "due": "2026-07-10",
    "completed": true
  },
  "timeline": [
    {
      "timestamp": "2026-07-21T01:41:42+02:00",
      "type": "saved",
      "description": "Vacancy added to Brainjob"
    },
    {
      "timestamp": "2026-07-21T00:00:00+00:00",
      "type": "archived",
      "description": "Archived — application deadline passed 2026-06-26 without applying"
    }
  ],
  "interviews": [],
  "assessments": [],
  "offer": null,
  "outcome": "missed_deadline"
}
