{
  "job_id": "transport-environment-communications-officer",
  "status": "saved",
  "saved_date": "2026-07-21",
  "applied_date": null,
  "withdrawn_date": null,
  "decision_date": null,
  "next_action": {
    "description": "Review T&E Communications Officer fit and prepare application materials",
    "due": "2026-07-22",
    "completed": false
  },
  "timeline": [
    {
      "timestamp": "2026-07-21T01:41:42+02:00",
      "type": "saved",
      "description": "Vacancy added to Brainjob"
    }
  ],
  "interviews": [],
  "assessments": [],
  "offer": null,
  "outcome": null
}
