{
  "job_id": "giz-junior-advisor-for-the-global-gateway-investment-climate-reform-facility",
  "status": "saved",
  "saved_date": "2026-07-21",
  "applied_date": null,
  "withdrawn_date": null,
  "decision_date": null,
  "next_action": {
    "description": "Review GG ICR fit and decide whether to apply via Euractiv",
    "due": "2026-07-27",
    "completed": false
  },
  "timeline": [
    {
      "timestamp": "2026-07-21T01:41:42+02:00",
      "type": "saved",
      "description": "Vacancy added to Brainjob"
    }
  ],
  "interviews": [],
  "assessments": [],
  "offer": null,
  "outcome": null
}
