{
  "job_id": "plan-international-climate-economic-empowerment-lead",
  "status": "archived",
  "saved_date": "2026-07-21",
  "applied_date": null,
  "withdrawn_date": null,
  "decision_date": "2026-07-21",
  "next_action": {
    "description": "Deadline passed (2026-07-12); archived without submitting application",
    "due": "2026-07-11",
    "completed": true
  },
  "timeline": [
    {
      "timestamp": "2026-07-21T01:41:42+02:00",
      "type": "saved",
      "description": "Vacancy added to Brainjob"
    },
    {
      "timestamp": "2026-07-21T00:00:00+00:00",
      "type": "archived",
      "description": "Archived — application deadline passed 2026-07-12; application preparation was in progress but not submitted"
    }
  ],
  "interviews": [],
  "assessments": [],
  "offer": null,
  "outcome": "missed_deadline"
}
