{
  "job_id": "icmpd-team-assistant",
  "status": "preparing",
  "saved_date": "2026-07-21",
  "applied_date": null,
  "withdrawn_date": null,
  "decision_date": null,
  "next_action": {
    "description": "URGENT: Deadline 2026-07-27 — decide EU-MIDCAP vs RRF assignment fit; confirm admin/coordination experience; draft and submit application",
    "due": "2026-07-25",
    "completed": false
  },
  "timeline": [
    {
      "timestamp": "2026-07-21T01:41:42+02:00",
      "type": "saved",
      "description": "Vacancy added to Brainjob"
    }
  ],
  "interviews": [],
  "assessments": [],
  "offer": null,
  "outcome": null
}
